{
  "schemaVersion": "0.2.0",
  "modelId": "checkout-qfd-fmeca",
  "scales": [
    {
      "id": "qfd",
      "label": "QFD relationship strength (unipolar; valence is the relationType)",
      "mode": "categorical",
      "levels": [
        { "observation": "none", "description": "No meaningful relationship.", "value": 0, "order": 0 },
        { "observation": "weak", "description": "Minor/indirect effect.", "value": 1, "order": 1 },
        { "observation": "moderate", "description": "Partial; contributes but not the primary mechanism.", "value": 3, "order": 2 },
        { "observation": "strong", "description": "Primary mechanism; direct and substantial.", "value": 9, "order": 3 }
      ]
    },
    {
      "id": "importance",
      "label": "Stakeholder importance",
      "mode": "categorical",
      "levels": [
        { "observation": "low", "description": "Nice-to-have; little consequence if unmet.", "value": 1, "order": 0 },
        { "observation": "medium", "description": "Valued; noticeable consequence if unmet.", "value": 3, "order": 1 },
        { "observation": "high", "description": "Critical; significant consequence if unmet.", "value": 9, "order": 2 }
      ]
    },
    {
      "id": "latency_measured",
      "label": "Latency exposure (MEASURED — code buckets a p95 ms value)",
      "mode": "measured",
      "levels": [
        { "observation": "weak", "description": "p95 < 50ms — negligible.", "value": 1, "range": { "min": 0, "max": 50 }, "order": 0 },
        { "observation": "moderate", "description": "50ms <= p95 < 200ms.", "value": 3, "range": { "min": 50, "max": 200 }, "order": 1 },
        { "observation": "strong", "description": "p95 >= 200ms — severe.", "value": 9, "range": { "min": 200 }, "order": 2 }
      ]
    }
  ],
  "dimensions": [
    {
      "id": "dim_req", "label": "Customer requirements", "kind": "customer_requirement", "order": 0,
      "weightSemantics": "stakeholder_importance", "weightScale": "importance",
      "members": [
        { "id": "req_fast_checkout", "label": "Fast checkout", "weightObservation": "high" },
        { "id": "req_secure_payment", "label": "Secure payment", "weightObservation": "high" },
        { "id": "req_easy_returns", "label": "Easy returns", "weightObservation": "medium" }
      ]
    },
    {
      "id": "dim_char", "label": "Engineering characteristics", "kind": "engineering_characteristic", "order": 1,
      "members": [
        { "id": "char_response_latency", "label": "Response latency" },
        { "id": "char_encryption", "label": "Encryption" },
        { "id": "char_idempotent_api", "label": "Idempotent payment API" },
        { "id": "char_return_workflow", "label": "Self-serve return workflow" }
      ]
    },
    {
      "id": "dim_fail", "label": "Failure modes (FMECA)", "kind": "failure_mode", "order": 2,
      "system": "fmeca", "weightSemantics": "fmeca_criticality",
      "members": [
        { "id": "fail_double_charge", "label": "Duplicate payment charge", "weight": 9, "sourceRef": { "system": "fmeca", "sourceRef": "FM-014", "contentHash": "xxh3:9a3f" } },
        { "id": "fail_latency_spike", "label": "Checkout latency spike", "weight": 3, "sourceRef": { "system": "fmeca", "sourceRef": "FM-031", "contentHash": "xxh3:2b80" } },
        { "id": "fail_data_breach", "label": "Cardholder data breach", "weight": 9, "sourceRef": { "system": "fmeca", "sourceRef": "FM-002", "contentHash": "xxh3:4e11" } }
      ]
    }
  ],
  "relations": [
    {
      "id": "rel_req_char", "from": "dim_req", "to": "dim_char", "relationType": "satisfies", "scale": "qfd",
      "cells": [
        { "from": "req_fast_checkout", "to": "char_response_latency", "observations": [ { "observation": "strong", "provenanceClass": "normative" } ] },
        { "from": "req_secure_payment", "to": "char_encryption", "observations": [
          { "observation": "strong", "provenanceClass": "observed", "confidence": "high", "sourceRef": { "system": "codebase", "sourceRef": "src/payment.ts", "contentHash": "xxh3:11aa" } },
          { "observation": "moderate", "provenanceClass": "inferred", "confidence": "medium", "evidence": [ { "sourceRef": { "system": "research", "sourceRef": "study/2026q1.md", "contentHash": "xxh3:22bb" }, "excerpt": "Users conflate encryption with 2FA." } ] }
        ] },
        { "from": "req_secure_payment", "to": "char_idempotent_api", "observations": [ { "observation": "moderate", "provenanceClass": "normative" } ] },
        { "from": "req_easy_returns", "to": "char_return_workflow", "observations": [ { "observation": "strong", "provenanceClass": "normative" } ] }
      ]
    },
    {
      "id": "rel_req_undermined_by_char", "from": "dim_req", "to": "dim_char", "relationType": "undermines", "scale": "qfd",
      "cells": [
        { "from": "req_fast_checkout", "to": "char_encryption", "observations": [ { "observation": "moderate", "provenanceClass": "observed", "rationale": "Crypto overhead works AGAINST fast checkout (separate valence, not a negative cell).", "evidence": [ { "sourceRef": { "system": "codebase", "sourceRef": "bench/latency.md", "locator": "L20-28", "contentHash": "xxh3:7c1d" }, "excerpt": "TLS adds ~40ms p95." } ] } ] }
      ]
    },
    {
      "id": "rel_char_exposes_fail", "from": "dim_char", "to": "dim_fail", "relationType": "exposes", "scale": "qfd",
      "cells": [
        { "from": "char_idempotent_api", "to": "fail_double_charge", "observations": [ { "observation": "strong", "provenanceClass": "observed" } ] },
        { "from": "char_encryption", "to": "fail_data_breach", "observations": [ { "observation": "strong", "provenanceClass": "observed" } ] }
      ]
    },
    {
      "id": "rel_latency_exposes_fail", "from": "dim_char", "to": "dim_fail", "relationType": "exposes", "scale": "latency_measured",
      "cells": [
        { "from": "char_response_latency", "to": "fail_latency_spike", "observations": [ { "observation": "weak", "measuredValue": 42, "provenanceClass": "observed", "sourceRef": { "system": "telemetry", "sourceRef": "grafana/checkout_p95", "contentHash": "xxh3:33cc" } } ] }
      ]
    },
    {
      "id": "rel_char_mitigates_fail", "from": "dim_char", "to": "dim_fail", "relationType": "mitigates", "scale": "qfd",
      "cells": [
        { "from": "char_encryption", "to": "fail_data_breach", "observations": [ { "observation": "strong", "provenanceClass": "normative", "rationale": "AES-256 + TLS mitigates breach." } ] }
      ]
    },
    {
      "id": "rel_char_internal_conflict", "from": "dim_char", "to": "dim_char", "relationType": "opposes", "scale": "qfd",
      "cells": [
        { "from": "char_encryption", "to": "char_response_latency", "observations": [ { "observation": "moderate", "provenanceClass": "observed", "rationale": "Intra-axis trade-off expressed as a SELF-relation (former 'roof'): crypto overhead increases latency." } ] }
      ]
    }
  ],
  "contractions": [
    {
      "id": "ctr_req_failure_exposure",
      "label": "Requirement -> failure exposure (support chain: rel_req_char  contracted with  rel_char_exposes_fail)",
      "chain": ["rel_req_char", "rel_char_exposes_fail"],
      "weightCombination": "product",
      "weightBySourceMembers": true
    }
  ]
}
